{
  "schemaVersion": 1,
  "id": "auth",
  "version": 1,
  "title": "Auth",
  "intents": [
    "sign in",
    "login",
    "log in",
    "sign up",
    "signup",
    "register",
    "two-factor",
    "2fa",
    "mfa",
    "reset password",
    "forgot password",
    "magic link",
    "sso"
  ],
  "purpose": "Sign in, sign up, verify, pass two-factor and reset a password without revealing whether an account exists.",
  "useWhen": [
    "A product authenticates people with passwords, SSO, emailed links or one-time codes."
  ],
  "avoidWhen": [
    "Re-confirming identity before one sensitive action inside the product; use the consequential-action contract with the provider's re-authentication."
  ],
  "alternatives": [
    "Use the provider's hosted sign-in page when the product delegates authentication entirely."
  ],
  "requiredInputs": [
    "the sign-in methods offered",
    "step adapters that never reveal whether an account exists",
    "rate-limit state with its wait",
    "link and code lifetimes",
    "the destination after sign-in"
  ],
  "states": [
    "sign-in",
    "submitting",
    "credentials-rejected",
    "rate-limited",
    "link-sent",
    "sign-up",
    "verify-email",
    "two-factor",
    "recovery-code",
    "reset",
    "link-expired",
    "signed-in"
  ],
  "transitions": [
    "sign-in → submitting → two-factor or signed-in, or credentials-rejected keeping the email",
    "credentials-rejected → rate-limited after the service's limit",
    "sign-in → link-sent, with a resend after a countdown",
    "sign-up → verify-email → signed-in",
    "two-factor → recovery-code → signed-in",
    "reset → link-sent"
  ],
  "rules": [
    "ALT-AUTH-001",
    "ALT-EDIT-002",
    "ALT-STATUS-001"
  ],
  "sources": [
    "owasp-auth",
    "wcag22",
    "task-review"
  ],
  "authority": "contextual-pattern",
  "applicability": "Sign-in, sign-up, verification, two-factor and password reset screens.",
  "exceptions": [
    "Require only the methods the product offers; the security of authentication itself is the application's."
  ],
  "maturity": "provisional",
  "evidenceStatus": "engineering-fixtures; human-effectiveness-unmeasured",
  "document": "patterns/auth.md",
  "implementation": "build/fixtures/patterns/auth.jsx",
  "examples": [
    "build/fixtures/patterns/auth.jsx"
  ],
  "verification": [
    "build/checks/auth-pattern.mjs",
    "build/checks/pattern-types.mjs"
  ]
}
